{
  "$schema": "./site.schema.json",
  "profile": {
    "name": "Omar Abu Qahf",
    "initials": "OA",
    "role": "Product Development · Mechanical Design",
    "tagline": "Product Development Engineer · ELARABY Group",
    "footerTagline": "From sketch to shippable product.",
    "email": "",
    "phone": "",
    "whatsapp": "",
    "linkedIn": "https://www.linkedin.com/in/omar-abo-qahf/",
    "cvUrl": "/Omar_Abu_Qahf___Resume.pdf",
    "portrait": "/omar-portrait.jpg",
    "portraitAlt": "Omar Abu Qahf, Product Development and Mechanical Design Engineer",
    "portraitBadge": "CATIA · EBOM"
  },
  "nav": [
    { "label": "Products", "href": "#work", "mobileLabel": "Selected products" },
    { "label": "Impact", "href": "#proof", "mobileLabel": "Impact" },
    { "label": "Trade-offs", "href": "#game", "mobileLabel": "Design trade-offs" },
    { "label": "About", "href": "#about" },
    { "label": "CV ↓", "href": "#contact", "mobileLabel": "Download CV ↓" }
  ],
  "hero": {
    "eyebrow": "Product Development Engineer · ELARABY Group",
    "headline": "I turn concepts into parts that survive production.",
    "lead": "Mechanical design engineer connecting product development and the factory floor. From first sketch in CATIA and 3DExperience through EBOM, prototype testing, and DFM — I work where CAD, tolerance, and the line all have to agree.",
    "primaryCta": "See the work",
    "secondaryCta": "Download CV",
    "proofStats": [
      { "value": "CATIA · 3DExperience", "label": "daily design stack" },
      { "value": "SAP · EBOM", "label": "lifecycle ownership" },
      { "value": "DFM · DFMEA · GD&T", "label": "production discipline" }
    ],
    "floatingNotes": [
      { "label": "SHOWING", "value": "Washing machine CAD" },
      { "label": "VIEWING", "value": "ELARABY Group" }
    ],
    "footerLine": "Concept → CAD → EBOM → prototype → validation → production handoff"
  },
  "deliveryStrip": {
    "label": "Built in this context",
    "clients": [
      "ELARABY Group",
      "Front-load washing machines",
      "Injection molding & sheet metal",
      "Ain Shams University · Cairo"
    ]
  },
  "impact": {
    "kicker": "Proof before promises",
    "title": "Output you can trace to the line.",
    "description": "Metrics and practices from product development at ELARABY Group and mechanical design work at ASUWind — not generic team claims.",
    "stats": [
      {
        "value": 2,
        "suffix": "+",
        "label": "Years across product development and mechanical design roles in appliances and renewables"
      },
      {
        "value": 3,
        "suffix": "+",
        "label": "Production CAD environments — CATIA, 3DExperience, Solidworks, and NX"
      },
      {
        "value": 6,
        "label": "Core practices in daily work — DFM, DFMEA, GD&T, EBOM, SAP, and ISO-aligned documentation"
      },
      {
        "value": 2022,
        "label": "B.Sc. Mechanical Design & Production Engineering — Ain Shams University"
      }
    ]
  },
  "featuredProjectId": "elaraby-appliance",
  "work": {
    "kicker": "Most relevant work first",
    "title": "Designed, validated, industrialized.",
    "description": "Front-load washing machine mechanical design at ELARABY Group — open any card for challenge, contribution, and outcome.",
    "libraryKicker": "More engineering range",
    "libraryTitle": "Six more builds, same rigor.",
    "libraryCount": "12 projects in total"
  },
  "projects": {
    "elaraby-appliance": {
      "title": "Front-Load Drum Assembly",
      "category": "Product Development · ELARABY Group",
      "hook": "A washing-machine drum that has to spin, drain, and survive thousands of cycles — not just render cleanly in CATIA.",
      "challenge": "Develop the drum assembly architecture for a front-load appliance program: perforated shell, flange interfaces, mounting features, and integration with the tub and drive system under production schedules.",
      "work": "Modeled the full drum, flange assemblies, and related interfaces in CATIA and 3DExperience. Ran DFM reviews, managed EBOM structure, and iterated with production, quality, and suppliers on fit, tolerance, and manufacturability.",
      "result": "Release-ready drum family with documented EBOMs, section views for manufacturing, and validated interfaces for assembly at ELARABY Group.",
      "metric": "Production-bound",
      "tags": ["CATIA", "Drum assembly", "EBOM"],
      "image": "/designs/FULL DRUM DESIGN.png",
      "alt": "CAD render of a front-load washing machine drum assembly",
      "gallery": [
        "/designs/FULL DRUM DESIGN.png",
        "/designs/DRUM FLANGE ASSY.png",
        "/designs/DRUM REAR.png"
      ],
      "placement": "card"
    },
    "mold-injection": {
      "title": "Detergent Drawer Assembly",
      "category": "Product Development · Injection Molding",
      "hook": "Three compartments, clip features, and fill marks — a small part that every user touches every load.",
      "challenge": "Design the detergent drawer and auto-dose covers for a front-load washing machine: moldable geometry, clear fill indicators, reliable latch behavior, and clean assembly into the fascia.",
      "work": "Developed injection-molded drawer geometry with DFM/DFA review, draft and wall-thickness control, and tolerance definition for clip and seal interfaces.",
      "result": "Mold-ready drawer family with user-facing PUSH/MAX features and assembly interfaces validated for production tooling.",
      "metric": "DFM-ready",
      "tags": ["Injection molding", "DFM / DFA", "UI plastic"],
      "image": "/designs/DETERGENT DRAWER.png",
      "alt": "CAD render of a washing machine detergent drawer assembly",
      "gallery": [
        "/designs/DETERGENT DRAWER.png",
        "/designs/DETERRGENT CASE AUTO DOSE COVER.png"
      ],
      "placement": "card"
    },
    "sheet-metal-bracket": {
      "title": "Lower Frame Sheet Metal",
      "category": "Mechanical Design · Sheet Metal",
      "hook": "The chassis everything bolts to — flanges, relief cuts, and holes that have to line up on the punch press.",
      "challenge": "Design the lower frame sheet-metal structure for a washing machine platform: stiffness, mounting patterns, bend sequences, and interface clearance for pump, motor, and suspension parts.",
      "work": "Detailed flat-pattern and formed views with bend allowances, hole patterns, reinforcement ribs, and GD&T for critical mounting features.",
      "result": "Released sheet-metal frame designs with manufacturing-friendly geometry and documented tolerances for assembly at volume.",
      "metric": "Released to mfg",
      "tags": ["Sheet metal", "GD&T", "Chassis"],
      "image": "/designs/LOWER FRAME SHEETMETAL.png",
      "alt": "CAD render of a washing machine lower frame sheet-metal part",
      "gallery": [
        "/designs/LOWER FRAME SHEETMETAL.png",
        "/designs/LOWER FRAME.png",
        "/designs/PUMP BRACKET.png"
      ],
      "placement": "card"
    },
    "prototype-validation": {
      "title": "Drum Flange Assembly",
      "category": "Mechanical Design · Assembly",
      "hook": "The flange is where drum, shaft, and tub meet — tolerance stack-up lives here.",
      "challenge": "Integrate drum flange variants with rear drum geometry, bearing interfaces, and assembly hardware while keeping the stack-up closed for production.",
      "work": "Modeled flange assembly variants, ran interface and tolerance reviews, and documented section views for manufacturing and quality sign-off.",
      "result": "Validated flange family with clear critical characteristics and assembly documentation for the drum subsystem.",
      "metric": "Assembly-ready",
      "tags": ["Flange", "GD&T", "Stack-up"],
      "image": "/designs/DRUM FLANGE ASSY.png",
      "alt": "CAD render of a washing machine drum flange assembly",
      "gallery": [
        "/designs/DRUM FLANGE ASSY.png",
        "/designs/FLANGE ASSY 1.png",
        "/designs/FLANGE ASSY 2.png"
      ],
      "placement": "card"
    },
    "ebom-lifecycle": {
      "title": "Front-Load Control Panel",
      "category": "Product Development · ELARABY Group",
      "hook": "Glass, buttons, and mounting clips — the part users see every day has the tightest packaging on the machine.",
      "challenge": "Design the front-load control panel architecture: fascia openings, glass retention, UI module clearance, and sheet-metal or plastic sub-structure for a high-volume appliance line.",
      "work": "Developed control panel variants in CATIA, coordinated EBOM structure and engineering changes, and aligned CAD releases with SAP product data and supplier documentation.",
      "result": "Released panel family with traceable EBOM, variant control, and manufacturing-ready mounting and glass interfaces.",
      "metric": "EBOM managed",
      "tags": ["Control panel", "SAP", "EBOM"],
      "image": "/designs/CONTROL PANEL WITH GLASS .png",
      "alt": "CAD render of a front-load washing machine control panel with glass",
      "gallery": [
        "/designs/CONTROL PANEL WITH GLASS .png",
        "/designs/Front Load Control Panel.png",
        "/designs/CONTROL PANEL 1.png"
      ],
      "placement": "card",
      "containImage": true
    },
    "supplier-dfm": {
      "title": "Drum Wrapper — Sheet Metal Unfold",
      "category": "DFM · Sheet Metal · Sourcing",
      "hook": "If the flat pattern does not nest cleanly, the supplier quote tells you before the line does.",
      "challenge": "Optimize the drum wrapper sheet-metal design for bend sequence, material utilization, and supplier tooling while preserving structural and drainage requirements.",
      "work": "Produced unfold and formed views, ran DFM reviews with suppliers, and iterated cutouts and bend relief for manufacturability and cost.",
      "result": "Supplier-ready flat patterns with documented bend tables and fewer late tooling surprises on the wrapper subassembly.",